{
  "pack_id": "dev.codefabric.example",
  "pack_version": "1.0.0",
  "schema_version": "1.0",
  "targets": [
    {
      "ecosystem": "python",
      "package": "example-library",
      "version_requirement": ">=1.0,<2"
    }
  ],
  "records": [
    {
      "record_id": "dev.codefabric.example.open",
      "record_kind": "callable",
      "match": {
        "qualified_name": "example.open"
      },
      "semantics": {
        "summary": "Opens one modelled resource.",
        "effect_kinds": ["IO_READ"],
        "resource_kinds": ["FILE"]
      },
      "certainty": "MODELLED",
      "closed_world_fields": ["effects", "resources"],
      "provenance": {
        "source": "owner-reviewed API documentation",
        "reviewed_by": "ontology-owner",
        "reviewed_at": "2026-08-21",
        "source_digest": "b3:1111111111111111111111111111111111111111111111111111111111111111"
      }
    }
  ],
  "fixtures": [
    {
      "fixture_id": "dev.codefabric.fixture.positive",
      "fixture_kind": "positive",
      "input": {
        "target": "dev.codefabric.example",
        "qualified_name": "example.open"
      },
      "expected_record_ids": ["dev.codefabric.example.open"]
    },
    {
      "fixture_id": "dev.codefabric.fixture.negative",
      "fixture_kind": "negative",
      "input": {
        "target": "dev.codefabric.example",
        "qualified_name": "example.close"
      },
      "expected_record_ids": []
    },
    {
      "fixture_id": "dev.codefabric.fixture.version",
      "fixture_kind": "version-boundary",
      "input": {
        "target": "dev.codefabric.example",
        "qualified_name": "example.open"
      },
      "expected_record_ids": ["dev.codefabric.example.open"]
    }
  ],
  "pack_digest": "b3:2222222222222222222222222222222222222222222222222222222222222222",
  "signature": "ed25519:AAAAAAAAAAAAAAAAAAAAAAAAAAAAAAAAAAAAAAAAAAAAAAAAAAAAAAAAAAAAAAAAAAAAAAAAAAAAAAAAAAAAAA"
}
